indicator,value_type,self,description,Indicator Code,typeEmployment in agriculture (% of total employment),percent,Employment in agriculture ,% of total employment,SL.AGR.EMPL.ZS,Agriculture & Rural DevelopmentAgricultural irrigated land (% of total agricultural land),percent,Agricultural irrigated land ,% of total agricultural land,AG.LND.IRIG.AG.ZS,Agriculture & Rural DevelopmentAgricultural land (% of land area),percent,Agricultural land ,% of land area,AG.LND.AGRI.ZS,Agriculture & Rural Development"Agriculture, value added (constant 2005 US$)",dollar,"Agriculture, value added ",constant 2005 US$,NV.AGR.TOTL.KD,Agriculture & Rural Development"Agricultural machinery, tractors per 100 sq. km of arable land",number,Agricultural machinery,tractors per 100 sq. km of arable land,AG.LND.TRAC.ZS,Agriculture & Rural DevelopmentGDP growth (annual %),percent,GDP growth ,annual %,NY.GDP.MKTP.KD.ZG,Economy & GrowthGDP per capita (current US$),dollar,GDP per capita ,current US$,NY.GDP.PCAP.CD,Economy & GrowthImports of goods and services (% of GDP),percent,Imports of goods and services ,% of GDP,NE.IMP.GNFS.ZS,Economy & Growth"Inflation, GDP deflator (annual %)",percent,"Inflation, GDP deflator ",annual %,NY.GDP.DEFL.KD.ZG,Economy & Growth"Total reserves (includes gold, current US$)",dollar,Total reserves ,"includes gold, current US$",FI.RES.TOTL.CD,Economy & Growth"Children in employment, total (% of children ages 7-14)",percent,"Children in employment, total ",% of children ages 7-14,SL.TLF.0714.ZS,Social DevelopmentRefugee population by country or territory of asylum,number,Refugee population,by country or territory of asylum,SM.POP.REFG,Social DevelopmentProportion of seats held by women in national parliaments (%),percent,Proportion of seats held by women in national parliaments ,%,SG.GEN.PARL.ZS,Social Development"Vulnerable employment, total (% of total employment)",percent,"Vulnerable employment, total ",% of total employment,SL.EMP.VULN.ZS,Social Development"Water pollution, chemical industry (% of total BOD emissions)",percent,"Water pollution, chemical industry ",% of total BOD emissions,EE.BOD.CHEM.ZS,EnvironmentForest area (% of land area),percent,Forest area ,% of land area,AG.LND.FRST.ZS,EnvironmentReal interest rate (%),percent,Real interest rate ,%,FR.INR.RINR,Financial SectorBank capital to assets ratio (%),percent,Bank capital to assets ratio ,%,FB.BNK.CAPA.ZS,Financial SectorMarket capitalization of listed companies (current US$),dollar,Market capitalization of listed companies ,current US$,CM.MKT.LCAP.CD,Financial SectorDomestic credit provided by financial sector (% of GDP),percent,Domestic credit provided by financial sector ,% of GDP,FS.AST.DOMS.GD.ZS,Financial SectorEnergy use (kt of oil equivalent),kt,Energy use ,kt of oil equivalent,EG.USE.COMM.KT.OE,Energy & MiningEnergy production (kt of oil equivalent),kt,Energy production ,kt of oil equivalent,EG.EGY.PROD.KT.OE,Energy & MiningAlternative and nuclear energy (% of total energy use),percent,Alternative and nuclear energy ,% of total energy use,EG.USE.COMM.CL.ZS,Energy & Mining"Death rate, crude (per 1,000 people)",number,"Death rate, crude ","per 1,000 people",SP.DYN.CDRT.IN,Health"Health expenditure, total (% of GDP)",percent,"Health expenditure, total ",% of GDP,SH.XPD.TOTL.ZS,HealthPopulation growth (annual %),percent,Population growth ,annual %,SP.POP.GROW,HealthHealth expenditure per capita (current US$),dollar,Health expenditure per capita ,current US$,SH.XPD.PCAP,HealthInternet users (per 100 people),number,Internet users ,per 100 people,IT.NET.USER.P2,InfrastructureElectric power consumption (kWh per capita),kWh,Electric power consumption ,kWh per capita,EG.USE.ELEC.KH.PC,InfrastructureRail lines (total route-km),km,Rail lines ,total route-km,IS.RRS.TOTL.KM,Infrastructure"Air transport, registered carrier departures worldwide",number,Air transport,registered carrier departures worldwide,IS.AIR.DPRT,InfrastructurePoverty gap at national poverty line (%),percent,Poverty gap at national poverty line ,%,SI.POV.NAGP,InfrastructureIncome share held by lowest 10%,percent,Income share held by lowest 10%,,SI.DST.FRST.10,InfrastructureIncome share held by lowest 20%,percent,Income share held by lowest 20%,,SI.DST.FRST.20,InfrastructureIncome share held by highest 10%,percent,Income share held by highest 10%,,SI.DST.10TH.10,Infrastructure"Net flows on external debt, total (NFL, current US$)",dollar,"Net flows on external debt, total ","NFL, current US$",DT.NFL.DECT.CD,External Debt"Use of IMF credit (DOD, current US$)",dollar,Use of IMF credit ,"DOD, current US$",DT.DOD.DIMF.CD,External Debt"Total debt service (% of exports of goods, services and primary income)",percent,Total debt service ,"% of exports of goods, services and primary income",DT.TDS.DECT.EX.ZS,External DebtBirths attended by skilled health staff (% of total),percent,Births attended by skilled health staff ,% of total,SH.STA.BRTC.ZS,Gender"Prevalence of HIV, female (% ages 15-24)",percent,"Prevalence of HIV, female ",% ages 15-24,SH.HIV.1524.FE.ZS,Gender"Employees, industry, female (% of female employment)",percent,"Employees, industry, female ",% of female employment,SL.IND.EMPL.FE.ZS,GenderTotal tax rate (% of commercial profits),percent,Total tax rate ,% of commercial profits,IC.TAX.TOTL.CP.ZS,Private SectorTrade in services (% of GDP),percent,Trade in services ,% of GDP,BG.GSR.NFSV.GD.ZS,Private SectorDomestic credit to private sector (% of GDP),percent,Domestic credit to private sector ,% of GDP,FS.AST.PRVT.GD.ZS,Private SectorNew businesses registered (number),number,New businesses registered ,number,IC.BUS.NREG,Private SectorCash surplus/deficit (% of GDP),percent,Cash surplus/deficit ,% of GDP,GC.BAL.CASH.GD.ZS,Public Sector"Central government debt, total (% of GDP)",percent,"Central government debt, total ",% of GDP,GC.DOD.TOTL.GD.ZS,Public SectorMilitary expenditure (% of GDP),percent,Military expenditure ,% of GDP,MS.MIL.XPND.GD.ZS,Public Sector"Revenue, excluding grants (% of GDP)",percent,"Revenue, excluding grants ",% of GDP,GC.REV.XGRT.GD.ZS,Public Sector"Patent applications, residents",number,"Patent applications, residents",,IP.PAT.RESD,Science & Technology"Trademark applications, total",number,"Trademark applications, total",,IP.TMK.TOTL,Science & TechnologyResearch and development expenditure (% of GDP),percent,Research and development expenditure ,% of GDP,GB.XPD.RSDV.GD.ZS,Science & TechnologyHigh-technology exports (current US$),dollar,High-technology exports ,current US$,TX.VAL.TECH.CD,Science & TechnologyEmployment in agriculture (% of total employment),percent,Employment in agriculture ,% of total employment,SL.AGR.EMPL.ZS,Social Protection & LaborGDP per person employed (constant 1990 PPP $),dollar,GDP per person employed ,constant 1990 PPP $,SL.GDP.PCAP.EM.KD,Social Protection & Labor"Labor force participation rate, total (% of total population ages 15+)",percent,"Labor force participation rate, total ",% of total population ages 15+,,Social Protection & LaborAccess to electricity (% of population),percent,Access to electricity ,% of population,EG.ELC.ACCS.ZS,Climate ChangeCO2 emissions (metric tons per capita),metric tons,CO2 emissions ,metric tons per capita,EN.ATM.CO2E.PC,Climate ChangeLand area where elevation is below 5 meters (% of total land area),percent,Land area where elevation is below 5 meters ,% of total land area,AG.LND.EL5M.ZS,Climate ChangeForest area (% of land area),percent,Forest area ,% of land area,AG.LND.FRST.ZS,Climate ChangeImports of goods and services (% of GDP),percent,Imports of goods and services ,% of GDP,NE.IMP.GNFS.ZS,TradeExports of goods and services (% of GDP),percent,Exports of goods and services ,% of GDP,NE.EXP.GNFS.ZS,TradeMerchandise trade (% of GDP),percent,Merchandise trade ,% of GDP,TG.VAL.TOTL.GD.ZS,TradeHigh-technology exports (% of manufactured exports),percent,High-technology exports ,% of manufactured exports,TX.VAL.TECH.MF.ZS,Trade"Energy imports, net (% of energy use)",percent,"Energy imports, net ",% of energy use,EG.IMP.CONS.ZS,TradeUrban population (% of total),percent,Urban population ,% of total,SP.URB.TOTL.IN.ZS,Urban DevelopmentPoverty gap at urban poverty line (%),percent,Poverty gap at urban poverty line ,%,SI.POV.URGP,Urban DevelopmentPopulation in the largest city (% of urban population),percent,Population in the largest city ,% of urban population,EN.URB.LCTY.UR.ZS,Urban DevelopmentImproved water source (% of population with access),percent,Improved water source ,% of population with access,SH.H2O.SAFE.ZS,Urban Development"School enrollment, primary (% gross)",percent,"School enrollment, primary ",% gross,SE.PRM.ENRR,Education"Children out of school, primary",percent,"Children out of school, primary",,SE.PRM.UNER,Education"Literacy rate, adult total (% of people ages 15 and above)",percent,"Literacy rate, adult total ",% of people ages 15 and above,SE.ADT.LITR.ZS,EducationTrained teachers in primary education (% of total teachers),percent,Trained teachers in primary education ,% of total teachers,SE.PRM.TCAQ.ZS,Education"Primary completion rate, total (% of relevant age group)",percent,"Primary completion rate, total ",% of relevant age group,SE.PRM.CMPT.ZS,EducationImproved sanitation facilities (% of population with access),percent,Improved sanitation facilities ,% of population with access,SH.STA.ACSN,Aid EffectivenessNet migration,percent,Net migration,,SM.POP.NETM,Aid Effectiveness"Mortality rate, under-5 (per 1,000 live births)",number,"Mortality rate, under-5 ","per 1,000 live births",SH.DYN.MORT,Aid EffectivenessNet official development assistance received (current US$),dollar,Net official development assistance received ,current US$,DT.ODA.ODAT.CD,Aid EffectivenessMobile cellular subscriptions (per 100 people),number,Mobile cellular subscriptions ,per 100 people,IT.CEL.SETS.P2,Aid Effectiveness